{
  "id": "season-001",
  "title": "The Day of the Quiet Person",
  "locale": "en-GB",
  "version": 2,
  "description": "You are living one day in the life of someone who keeps most things to themselves. A person in their late twenties, competent but uncommitted, careful but not closed. This is simply a day.",
  "acts": [
    {
      "id": "act-01",
      "name": "Morning",
      "vignettes": [
        {
          "id": "vignette-001",
          "setting_beat": "The alarm was set for 7:15. You woke up at 6:52. The phone is face-down on the nightstand. You know there are messages. You can feel them there, waiting. The light through the curtain is not quite right for going back to sleep.",
          "ambient_audio": null,
          "ambient_art": null,
          "choices": [
            {
              "id": "choice-1",
              "label": "Pick up the phone. Go through it before getting up.",
              "weights": [
                { "dimension": "OCEAN-O", "delta": -0.1 },
                { "dimension": "OCEAN-C", "delta": -0.1 },
                { "dimension": "OCEAN-E", "delta": 0.2 },
                { "dimension": "OCEAN-A", "delta": 0.1 },
                { "dimension": "OCEAN-N", "delta": 0.1 },
                { "dimension": "SCH-STIMULATION", "delta": 0.2 },
                { "dimension": "SCH-SECURITY", "delta": -0.1 }
              ]
            },
            {
              "id": "choice-2",
              "label": "Leave the phone face-down. Get up first.",
              "weights": [
                { "dimension": "OCEAN-O", "delta": 0.1 },
                { "dimension": "OCEAN-C", "delta": 0.2 },
                { "dimension": "OCEAN-E", "delta": -0.1 },
                { "dimension": "OCEAN-N", "delta": -0.2 },
                { "dimension": "SCH-SELF_DIRECTION", "delta": 0.3 },
                { "dimension": "SCH-SECURITY", "delta": 0.1 }
              ]
            },
            {
              "id": "choice-3",
              "label": "Stay in bed a little longer. Not sleeping, just not starting yet.",
              "weights": [
                { "dimension": "OCEAN-O", "delta": 0.2 },
                { "dimension": "OCEAN-C", "delta": -0.2 },
                { "dimension": "OCEAN-E", "delta": -0.2 },
                { "dimension": "OCEAN-N", "delta": 0.1 },
                { "dimension": "SCH-HEDONISM", "delta": 0.2 },
                { "dimension": "SCH-STIMULATION", "delta": -0.1 }
              ]
            }
          ],
          "resolution_beats": {
            "choice-1": "The messages are mostly unremarkable. One from your mother. You'll answer later.",
            "choice-2": "You make coffee before you check anything. The messages will be exactly what they are whether you read them now or in ten minutes.",
            "choice-3": "Fourteen minutes pass. They are not wasted."
          }
        },
        {
          "id": "vignette-002",
          "setting_beat": "In the kitchen, while the coffee brews, you notice the plant on the windowsill is leaning hard toward the light. Not dying — just tilted, reaching. You've been meaning to rotate it for at least a week.",
          "ambient_audio": null,
          "ambient_art": null,
          "choices": [
            {
              "id": "choice-1",
              "label": "Rotate it now. You're already here.",
              "weights": [
                { "dimension": "OCEAN-C", "delta": 0.3 },
                { "dimension": "OCEAN-E", "delta": -0.1 },
                { "dimension": "SCH-SELF_DIRECTION", "delta": 0.1 },
                { "dimension": "ATT-SECURE", "delta": 0.1 }
              ]
            },
            {
              "id": "choice-2",
              "label": "Make a mental note. Rotate it this evening.",
              "weights": [
                { "dimension": "OCEAN-C", "delta": -0.1 },
                { "dimension": "OCEAN-O", "delta": 0.1 },
                { "dimension": "OCEAN-N", "delta": 0.1 },
                { "dimension": "SCH-SELF_DIRECTION", "delta": -0.1 }
              ]
            },
            {
              "id": "choice-3",
              "label": "Leave it. The leaning is actually kind of nice.",
              "weights": [
                { "dimension": "OCEAN-O", "delta": 0.3 },
                { "dimension": "OCEAN-C", "delta": -0.2 },
                { "dimension": "OCEAN-A", "delta": 0.1 },
                { "dimension": "SCH-UNIVERSALISM", "delta": 0.2 }
              ]
            }
          ],
          "resolution_beats": {
            "choice-1": "Done. It takes four seconds.",
            "choice-2": "You probably will. You probably won't.",
            "choice-3": "It has figured out the window on its own. Maybe that's enough."
          }
        },
        {
          "id": "vignette-003",
          "setting_beat": "You pass by your neighbor Berk in the stairwell. He is carrying three reusable bags of groceries and has clearly had a good morning. He starts talking before you've made eye contact. Something about a sale at the market. Something about his weekend. He is not asking you anything, but he has not stopped talking and is now at your door.",
          "ambient_audio": null,
          "ambient_art": null,
          "choices": [
            {
              "id": "choice-1",
              "label": "Listen. Let him finish. Respond warmly when he pauses.",
              "weights": [
                { "dimension": "OCEAN-E", "delta": 0.2 },
                { "dimension": "OCEAN-A", "delta": 0.3 },
                { "dimension": "OCEAN-N", "delta": -0.1 },
                { "dimension": "SCH-BENEVOLENCE", "delta": 0.2 },
                { "dimension": "ATT-SECURE", "delta": 0.2 }
              ]
            },
            {
              "id": "choice-2",
              "label": "Listen while slowly indicating you have to get somewhere.",
              "weights": [
                { "dimension": "OCEAN-E", "delta": -0.1 },
                { "dimension": "OCEAN-A", "delta": 0.1 },
                { "dimension": "OCEAN-C", "delta": 0.1 },
                { "dimension": "SCH-CONFORMITY", "delta": 0.1 },
                { "dimension": "ATT-SECURE", "delta": 0.1 }
              ]
            },
            {
              "id": "choice-3",
              "label": "Give him a friendly but firm 'I'm running late' before he gets going.",
              "weights": [
                { "dimension": "OCEAN-E", "delta": -0.2 },
                { "dimension": "OCEAN-A", "delta": -0.1 },
                { "dimension": "OCEAN-C", "delta": 0.2 },
                { "dimension": "SCH-SELF_DIRECTION", "delta": 0.2 },
                { "dimension": "OCEAN-N", "delta": 0.1 }
              ]
            },
            {
              "id": "choice-4",
              "label": "Stay and listen — he is clearly in a good mood and that's worth something.",
              "weights": [
                { "dimension": "OCEAN-E", "delta": 0.1 },
                { "dimension": "OCEAN-A", "delta": 0.4 },
                { "dimension": "OCEAN-O", "delta": 0.2 },
                { "dimension": "SCH-BENEVOLENCE", "delta": 0.3 },
                { "dimension": "ATT-SECURE", "delta": 0.3 }
              ]
            }
          ],
          "resolution_beats": {
            "choice-1": "He wraps up in about four minutes. You genuinely don't mind.",
            "choice-2": "You extract yourself politely. He doesn't seem to notice or mind.",
            "choice-3": "He takes it in stride. You're inside before the guilt gets too loud.",
            "choice-4": "He tells you about his sister's new dog. You didn't know he had a sister."
          }
        },
        {
          "id": "vignette-004",
          "setting_beat": "On the bus to work, a seat opens up next to someone reading a book you loved three years ago. The cover is visible. They are near the end. You remember how that last section hit you.",
          "ambient_audio": null,
          "ambient_art": null,
          "choices": [
            {
              "id": "choice-1",
              "label": "Say something. Just: 'That ending is something.'",
              "weights": [
                { "dimension": "OCEAN-E", "delta": 0.3 },
                { "dimension": "OCEAN-O", "delta": 0.2 },
                { "dimension": "OCEAN-A", "delta": 0.1 },
                { "dimension": "SCH-STIMULATION", "delta": 0.2 },
                { "dimension": "ATT-SECURE", "delta": 0.2 }
              ]
            },
            {
              "id": "choice-2",
              "label": "Don't say anything. The moment exists whether or not you acknowledge it.",
              "weights": [
                { "dimension": "OCEAN-E", "delta": -0.2 },
                { "dimension": "OCEAN-O", "delta": 0.3 },
                { "dimension": "SCH-SELF_DIRECTION", "delta": 0.2 },
                { "dimension": "OCEAN-N", "delta": -0.1 },
                { "dimension": "ATT-AVOIDANT", "delta": 0.1 }
              ]
            },
            {
              "id": "choice-3",
              "label": "Almost say something, then decide against it when they seem very absorbed.",
              "weights": [
                { "dimension": "OCEAN-E", "delta": -0.1 },
                { "dimension": "OCEAN-O", "delta": 0.2 },
                { "dimension": "OCEAN-A", "delta": 0.2 },
                { "dimension": "OCEAN-N", "delta": 0.1 },
                { "dimension": "ATT-ANXIOUS", "delta": 0.1 }
              ]
            }
          ],
          "resolution_beats": {
            "choice-1": "They look up. 'You've read it?' The next twelve minutes are the best conversation you'll have this week.",
            "choice-2": "You sit with the memory of the book instead. It's still yours.",
            "choice-3": "You watch them reach a passage you remember. Their expression changes slightly. That's enough."
          }
        },
        {
          "id": "vignette-005",